Movie Title,Year,Score,Director,Cast,Consensus
The Rock,1996,67,Michael Bay,"Sean Connery, Nicolas Cage, Ed Harris, Michael Biehn","For visceral thrills, it can't be beat. Just don't expect The Rock to engage your brain."
RoboCop,1987,91,Paul Verhoeven,"Peter Weller, Nancy Allen, Ronny Cox, Dan O'Herlihy","While over-the-top and gory, Robocop is also a surprisingly smart sci-fi flick that uses ultraviolence to disguise its satire of American culture."
John Wick: Chapter 2,2017,89,Chad Stahelski,"Keanu Reeves, Common, Laurence Fishburne, Riccardo Scamarcio","John Wick: Chapter 2 does what a sequel should -- which in this case means doubling down on the non-stop, thrillingly choreographed action that made its predecessor so much fun."
Casino Royale,2006,94,Martin Campbell,"Daniel Craig, Eva Green, Mads Mikkelsen, Judi Dench","Casino Royale disposes of the silliness and gadgetry that plagued recent James Bond outings, and Daniel Craig delivers what fans and critics have been waiting for: a caustic, haunted, intense reinvention of 007."
Baby Driver,2017,92,Edgar Wright,"Ansel Elgort, Kevin Spacey, Lily James, Jon Bernthal","Stylish, exciting, and fueled by a killer soundtrack, Baby Driver hits the road and it's gone -- proving fast-paced action movies can be smartly written without sacrificing thrills."
Fist of Legend,1994,100,Gordon Chan,"Jet Li, Chin Siu Ho, Billy Chow Bei-Lei, Yasuaki Kurata",No consensus yet.
The Killer,1989,98,John Woo,"Chow Yun-Fat, Danny Lee, Sally Yeh, Kenneth Tsang",The Killer is another hard-boiled action flick from John Woo featuring eye-popping balletic violence and philosophical underpinnings.
The Raid 2,2014,82,Gareth Evans,"Iko Uwais, Yayan Ruhian, Arifin Putra, Oka Antara","Although its high-energy plot and over-the-top violence may play better with genre aficionados, The Raid 2 definitely delivers more of everything audiences loved about its predecessor."
Enter the Dragon,1973,88,Robert Clouse,"Bruce Lee, John Saxon, Jim Kelly, Ahna Capri","Badass to the max, Enter the Dragon is the ultimate kung-fu movie and a fitting (if untimely) Bruce Lee swan song."
Commando,1985,67,Mark L. Lester,"Arnold Schwarzenegger, Rae Dawn Chong, Dan Hedaya, Vernon Wells","The ultimate '80s Schwarzenegger movie, replete with a threadbare plot, outsized action, and endless one-liners."
First Blood,1982,86,Ted Kotcheff,"Sylvester Stallone, Richard Crenna, Brian Dennehy, David Caruso","Much darker and more sensitive than the sequels it spawned, First Blood is a thrilling survival adventure that takes full advantage of Sylvester Stallone's acting skills."
Mission: Impossible Rogue Nation,2015,94,Christopher McQuarrie,"Tom Cruise, Jeremy Renner, Simon Pegg, Rebecca Ferguson",Mission: Impossible Rogue Nation continues the franchise's thrilling resurgence -- and proves that Tom Cruise remains an action star without equal.
The Terminator,1984,100,James Cameron,"Arnold Schwarzenegger, Linda Hamilton, Michael Biehn, Paul Winfield","With its impressive action sequences, taut economic direction, and relentlessly fast pace, it's clear why The Terminator continues to be an influence on sci-fi and action flicks."
Gladiator,2000,80,Ridley Scott,"Russell Crowe, Joaquin Phoenix, Connie Nielsen, Oliver Reed","While not everyone will be entertained by Gladiator's glum revenge story, Russell Crowe thunderously wins the crowd with a star-making turn that provides Ridley Scott's opulent resurrection of Rome its bruised heart."
Kill Bill: Vol. 1,2003,85,Quentin Tarantino,"Uma Thurman, Lucy Liu, Vivica A. Fox, Michael Madsen",Kill Bill is admittedly little more than a stylish revenge thriller -- albeit one that benefits from a wildly inventive surfeit of style.
The Professional,1994,74,Luc Besson,"Jean Reno, Gary Oldman, Natalie Portman, Danny Aiello",Pivoting on the unusual relationship between seasoned hitman and his 12-year-old apprentice -- a breakout turn by young Natalie Portman -- Luc Besson's Léon is a stylish and oddly affecting thriller.
Speed,1994,95,Jan de Bont,"Keanu Reeves, Dennis Hopper, Sandra Bullock, Joe Morton","A terrific popcorn thriller, Speed is taut, tense, and energetic, with outstanding performances from Keanu Reeves, Dennis Hopper, and Sandra Bullock."
Drunken Master II,1994,84,Chia-Liang Liu,"Jackie Chan, Ti Lung, Anita Mui, Chia-Liang Liu",Jackie Chan sends up some amazing and entertaining fight sequences in The Legend of Drunken Master.
John Wick,2014,86,Chad Stahelski,"Keanu Reeves, Michael Nyqvist, Alfie Allen, Willem Dafoe","Stylish, thrilling, and giddily kinetic, John Wick serves as a satisfying return to action for Keanu Reeves -- and what looks like it could be the first of a franchise."
"Crouching Tiger, Hidden Dragon",2000,98,Ang Lee,"Chow Yun-Fat, Michelle Yeoh, Zhang Ziyi, Chang Chen","The movie that catapulted Ang Lee into the ranks of upper echelon Hollywood filmmakers, Crouching Tiger, Hidden Dragon features a deft mix of amazing martial arts battles, beautiful scenery, and tasteful drama."
Predator,1987,80,John McTiernan,"Arnold Schwarzenegger, Carl Weathers, Jesse Ventura, Elpidia Carrillo","Predator: Part sci-fi, part horror, part action -- all muscle."
The Bourne Ultimatum,2007,92,Paul Greengrass,"Matt Damon, Julia Stiles, Joan Allen, David Strathairn","The Bourne Ultimatum is an intelligent, finely tuned non-stop thrill ride. Another strong performance from Matt Damon and sharp camerawork from Paul Greengrass make this the finest installment of the Bourne trilogy."
Total Recall,1990,82,Paul Verhoeven,"Arnold Schwarzenegger, Rachel Ticotin, Sharon Stone, Ronny Cox","Under Paul Verhoeven's frenetic direction, Total Recall is a fast-paced rush of violence, gore, and humor that never slacks."
Mad Max 2: The Road Warrior,1981,95,George Miller,"Mel Gibson, Bruce Spence, Emil Minty, Vernon Wells","The Road Warrior is everything a bigger-budgeted Mad Max sequel with should be: bigger, faster, louder, but definitely not dumber."
Heat,1995,88,Michael Mann,"Al Pacino, Robert De Niro, Val Kilmer, Jon Voight","Though Al Pacino and Robert De Niro share but a handful of screen minutes together, Heat is an engrossing crime drama that draws compelling performances from its stars -- and confirms Michael Mann's mastery of the genre."
The Raid: Redemption,2011,87,Gareth Evans,"Iko Uwais, Joe Taslim, Donny Alamsyah, Yayan Ruhian","No frills and all thrills, The Raid: Redemption is an inventive action film expertly paced and edited for maximum entertainment."
Mission: Impossible - Fallout,2018,97,Christopher McQuarrie,"Tom Cruise, Henry Cavill, Ving Rhames, Simon Pegg","Fast, sleek, and fun, Mission: Impossible - Fallout lives up to the ""impossible"" part of its name by setting yet another high mark for insane set pieces in a franchise full of them."
Raiders of the Lost Ark,1981,93,Steven Spielberg,"Harrison Ford, Karen Allen, Paul Freeman, Wolf Kahler","Featuring bravura set pieces, sly humor, and white-knuckle action, Raiders of the Lost Ark is one of the most consummately entertaining adventure pictures of all time."
Aliens,1986,98,James Cameron,"Sigourney Weaver, Carrie Henn, Michael Biehn, Paul Reiser","While Alien was a marvel of slow-building, atmospheric tension, Aliens packs a much more visceral punch, and features a typically strong performance from Sigourney Weaver."
Hard-Boiled,1992,95,John Woo,"Chow Yun-Fat, Bowie Lam, Philip Chan, Tony Leung Chiu Wai","Boasting impactful action as well as surprising emotional resonance, Hard Boiled is a powerful thriller that hits hard in more ways than one."
The Matrix,1999,82,Lilly Wachowski,"Keanu Reeves, Laurence Fishburne, Carrie-Anne Moss, Hugo Weaving","Thanks to the Wachowskis' imaginative vision, The Matrix is a smartly crafted combination of spectacular action and groundbreaking special effects."
Terminator 2: Judgment Day,1991,91,James Cameron,"Arnold Schwarzenegger, Linda Hamilton, Edward Furlong, Robert Patrick","T2 features thrilling action sequences and eye-popping visual effects, but what takes this sci-fi/ action landmark to the next level is the depth of the human (and cyborg) characters."
Die Hard,1988,94,John McTiernan,"Bruce Willis, Alan Rickman, Bonnie Bedelia, Reginald VelJohnson",Its many imitators (and sequels) have never come close to matching the taut thrills of the definitive holiday action classic.
Mad Max: Fury Road,2015,97,George Miller,"Tom Hardy, Charlize Theron, Nicholas Hoult, Hugh Keays-Byrne","With exhilarating action and a surprising amount of narrative heft, Mad Max: Fury Road brings George Miller's post-apocalyptic franchise roaring vigorously back to life."
